{
  "schema_version": 1,
  "job_id": "kv-q4-qat-example",
  "created_by": "modelbuilder 0.1.0",
  "backend": "torch",
  "device": "cuda",
  "hardware_profile": "1x80GB",
  "output_dir": "runs/kv-q4-qat-example",
  "stages": [
    {
      "name": "kv-q4-qat",
      "kind": "trunk_distill",
      "trunk_distill": {
        "model": "runs/target-hf",
        "texts": "corpus/distill.jsonl",
        "trainable": [
          "self_attn.k_proj.weight",
          "self_attn.v_proj.weight",
          "self_attn.k_norm.weight"
        ],
        "kv_format": "q4_0",
        "kv_share_group": null,
        "weight_fakequant": true,
        "eval_fraction": 0.05
      },
      "hyper": {
        "lr": 2e-05,
        "steps": 1000,
        "seq_len": 2048,
        "batch_seqs": 4,
        "warmup_steps": 50,
        "weight_decay": 0.0,
        "grad_clip": 1.0,
        "log_every": 10,
        "eval_every": 100,
        "seed": 0,
        "dtype": "bfloat16"
      }
    }
  ]
}
